{
  "version": 1,
  "name": "Slow swing test",
  "duration": 10,
  "tracks": [
    {
      "id": "track_boom",
      "axis": 0,
      "label": "Boom",
      "color": "#e85d5d",
      "clips": []
    },
    {
      "id": "track_swing",
      "axis": 1,
      "label": "Swing",
      "color": "#d4b84a",
      "clips": [
        {
          "id": "c_sw1",
          "type": "MoveClip",
          "start": 1,
          "duration": 6,
          "from_pos": 0,
          "to_pos": 1800,
          "label": "Swing"
        }
      ]
    },
    {
      "id": "track_yaw",
      "axis": 2,
      "label": "Yaw",
      "color": "#5de88a",
      "clips": []
    },
    {
      "id": "track_pitch",
      "axis": 3,
      "label": "Pitch",
      "color": "#4f8cff",
      "clips": [
        {
          "id": "c_pi1",
          "type": "MoveClip",
          "start": 2,
          "duration": 4,
          "from_pos": 0,
          "to_pos": -320,
          "label": "Tilt"
        }
      ]
    }
  ],
  "camera_tracks": [
    {
      "id": "record",
      "label": "Record",
      "color": "#c44d6d",
      "clips": [
        {
          "id": "c_r1",
          "type": "RecordClip",
          "start": 0.5,
          "duration": 0.25,
          "action": "start",
          "label": "▶"
        },
        {
          "id": "c_r2",
          "type": "RecordClip",
          "start": 8.5,
          "duration": 0.25,
          "action": "stop",
          "label": "■"
        }
      ]
    },
    {
      "id": "zoom",
      "label": "Zoom",
      "color": "#2d9d8a",
      "clips": [
        {
          "id": "c_z1",
          "type": "ZoomClip",
          "start": 3,
          "duration": 4,
          "from_zoom": 1.0,
          "to_zoom": 1.5,
          "label": "Zoom"
        }
      ]
    },
    {
      "id": "focus",
      "label": "Focus",
      "color": "#d4844a",
      "clips": []
    }
  ]
}
